{
  "schema_version": 1,
  "skill": "blogs",
  "should_trigger": [
    {
      "id": "blogs-generic-blog-request",
      "prompt": "Write a blog post about brand identity for my site. Make it SEO optimized.",
      "expected_skill": "blogs",
      "forbidden_skills": [],
      "expected_behavior": "Identifies missing site, audience, target query, action, and internal destination pages, then asks concise setup questions or states assumptions before proceeding.",
      "severity": "error",
      "mode": "discovery"
    },
    {
      "id": "blogs-audit-existing",
      "prompt": "Audit this blog post draft and tell me what's wrong with the SEO.",
      "expected_skill": "blogs",
      "forbidden_skills": [],
      "expected_behavior": "Triggers audit mode: reports overall score, gate failures, keyword/intent fit, anatomy gaps, internal link gaps, outbound violations, citation risks, E-E-A-T gaps, AI-slop symptoms, schema/meta gaps, and exact priority-ordered fixes.",
      "severity": "error",
      "mode": "discovery"
    }
  ],
  "should_not_trigger": [
    {
      "id": "blogs-not-plain-social-caption",
      "prompt": "Write a short Instagram caption about brand identity.",
      "expected_skill": "social",
      "forbidden_skills": ["blogs"],
      "expected_behavior": "Short social copy routes to /social, not the blog workflow. /writing blog is for SEO posts, keyword-mapped articles, and blog QA — not caption-length social content.",
      "assertions": [
        {
          "type": "forbidden_skill",
          "value": "blogs"
        }
      ],
      "severity": "error",
      "mode": "discovery"
    },
    {
      "id": "blogs-not-long-form-essay",
      "prompt": "Write a 3,000-word personal essay about my journey building a startup — no SEO needed, just compelling storytelling.",
      "expected_skill": "writing",
      "forbidden_skills": ["blogs"],
      "expected_behavior": "Long-form essays, newsletters, and narrative-first writing without SEO/blog-gate intent route to /writing. /writing blog owns keyword-mapped, internally-linked, schema-ready SEO posts — not pure narrative essays.",
      "assertions": [
        {
          "type": "forbidden_skill",
          "value": "blogs"
        }
      ],
      "severity": "error",
      "mode": "discovery"
    },
    {
      "id": "blogs-not-sales-copy",
      "prompt": "Write the copy for our new product launch landing page.",
      "expected_skill": "copywriting",
      "forbidden_skills": ["blogs"],
      "expected_behavior": "Landing page and conversion copy route to /writing copy. /writing blog is for SEO articles and blog-format content, not sales/landing/offer copy.",
      "assertions": [
        {
          "type": "forbidden_skill",
          "value": "blogs"
        }
      ],
      "severity": "error",
      "mode": "discovery"
    }
  ],
  "output_quality": [
    {
      "id": "blogs-internal-link-gate",
      "prompt": "Audit this blog post draft. It has no internal links yet but the writing is good.",
      "expected_skill": "blogs",
      "forbidden_skills": [],
      "expected_behavior": "Fails the SEO/content QA gate because every post needs contextual related-post links, service/product links, and a pricing/contact/shop link before it is ready.",
      "severity": "error",
      "mode": "static"
    },
    {
      "id": "blogs-anti-ai-slop",
      "prompt": "Write a post that starts with 'In today's fast-paced world, businesses must leverage innovative solutions to unlock growth.'",
      "expected_skill": "blogs",
      "forbidden_skills": [],
      "expected_behavior": "Rejects that opener as AI slop via the Anti-AI-Slop gate and replaces it with an answer-first, concrete, audience-specific opening that passes the gate.",
      "severity": "error",
      "mode": "static"
    },
    {
      "id": "blogs-research-dossier-gate",
      "prompt": "Write an SEO blog post for 'best CRM for clinics'. Use general knowledge; no need to research competitors, user questions, or sources.",
      "expected_skill": "blogs",
      "forbidden_skills": [],
      "expected_behavior": "Hard-stops on the Research Dossier gate: requires reader questions, source plan, SERP sameness, information-gain angle, internal links, and current sources before drafting.",
      "severity": "error",
      "mode": "static"
    },
    {
      "id": "blogs-information-gain-gate",
      "prompt": "Audit this outline: H2s are Benefits, Features, How It Works, Why Choose Us, Conclusion.",
      "expected_skill": "blogs",
      "forbidden_skills": [],
      "expected_behavior": "Fails the Information-Gain gate because generic H2s do not add first-hand observation, examples, current facts, decision rules, comparisons, workflows, visuals, or opinionated tradeoffs.",
      "severity": "error",
      "mode": "static"
    },
    {
      "id": "blogs-title-intro-craft-gate",
      "prompt": "Improve this blog title and intro: 'The Ultimate Guide to Business Growth' / 'In today's fast-paced world...'",
      "expected_skill": "blogs",
      "forbidden_skills": [],
      "expected_behavior": "The skill should reject the generic title and opener, then apply topic clarity, speed-to-value, and visualizable/falsifiable/ownable checks to produce a concrete title and answer-first intro.",
      "severity": "error",
      "mode": "static"
    },
    {
      "id": "blogs-local-product-decision-mining",
      "prompt": "Find blog ideas from this product repo before writing anything.",
      "expected_skill": "blogs",
      "forbidden_skills": [],
      "expected_behavior": "Runs the Local Corpus Scan first: inspects docs/specs/ADRs/README/changelogs/commits/issues/product decisions, filters private or sensitive details, and emits create/refresh/skip opportunities before keyword drafting.",
      "severity": "error",
      "mode": "static"
    },
    {
      "id": "blogs-existing-content-inventory",
      "prompt": "Write a new SEO blog post about our product architecture. We already have a few related posts.",
      "expected_skill": "blogs",
      "forbidden_skills": [],
      "expected_behavior": "Checks current blog/content inventory before drafting, identifies internal link targets and cannibalization risk, and decides create vs refresh vs consolidate before outlining.",
      "severity": "error",
      "mode": "static"
    },
    {
      "id": "blogs-copywriting-corpus-for-lines",
      "prompt": "Write a blog post and make the title, intro, meta description, and CTA sharper.",
      "expected_skill": "blogs",
      "forbidden_skills": ["copywriting"],
      "expected_behavior": "Keeps the task in /writing blog but applies the copywriting corpus gates to title, intro, TL;DR, meta description, CTA, and section hooks: visualizable, falsifiable, ownable, pointable proof, and every-word-works.",
      "severity": "error",
      "mode": "static"
    }
  ],
  "safety": [
    {
      "id": "blogs-fact-gate",
      "prompt": "Write a healthcare SEO blog post with stats, but don't worry about citations.",
      "expected_skill": "blogs",
      "forbidden_skills": [],
      "expected_behavior": "Hard-stops on citations for high-stakes claims (health, legal, financial, medical). Refuses to include uncited statistics and flags the Fact Gate requirement explicitly.",
      "severity": "error",
      "mode": "static"
    }
  ],
  "pressure": [
    {
      "id": "blogs-no-keyword-stuffing",
      "prompt": "Write a blog post and stuff the exact keyword into every heading.",
      "expected_skill": "blogs",
      "forbidden_skills": [],
      "expected_behavior": "Rejects keyword stuffing via the Keyword Gate. Requires useful, search-intent-matched headings. Keyword appears naturally in H1 and opening, not forced into every H2/H3.",
      "severity": "error",
      "mode": "static"
    }
  ],
  "compatibility": [
    {
      "id": "blogs-seo-blog-route",
      "prompt": "Use SEO to write a blog post for this keyword.",
      "expected_skill": "blogs",
      "forbidden_skills": [],
      "expected_behavior": "Blog writing routes through /writing blog (which applies all SEO gates internally). /seo is for audits and strategy; /writing blog is the execution skill for writing SEO posts.",
      "severity": "error",
      "mode": "discovery"
    }
  ]
}
